{
  "repo": ".claude-prime",
  "coordinator_root_path": ".",
  "sha_range": "a8acd77e..c3f67d33",
  "reviewer": "code-reviewer",
  "verdict": "warn",
  "diff_loc": 214,
  "reviewed_at": "2026-06-14T12:23:57Z",
  "workstream": "opticon-contract-reshape",
  "provenance": {
    "source_kind": "coordinator_artifact",
    "repo": ".claude-prime",
    "ref": { "branch": "work/machine-b/2026-06-17to22", "sha": "647732fa" },
    "path": "state/review-trail/2026-06-14-122357175233-5dbdc516.json",
    "observed_at": "2026-06-22T03:03:00Z",
    "derivation": "parsed"
  }
}
